{
  "$schema": "https://json-schema.org/draft/2020-12/schema",
  "$id": "https://zob.local/schemas/project-dna-manifest.v2.json",
  "title": "ProjectDNA Manifest v2",
  "type": "object",
  "additionalProperties": false,
  "required": [
    "schema",
    "run_id",
    "user_note",
    "capture_goal",
    "requested_compute_profile",
    "capture_mode_policy",
    "source_project",
    "read_policy",
    "sample_project",
    "promotion"
  ],
  "properties": {
    "schema": { "const": "zob.project-dna-manifest.v2" },
    "run_id": { "type": "string", "pattern": "^[A-Za-z0-9._-]+$" },
    "user_note": { "type": "string", "minLength": 1, "maxLength": 1000 },
    "capture_goal": {
      "type": "object",
      "additionalProperties": false,
      "required": ["source_id", "objective", "bounded_context_only", "citation_required"],
      "properties": {
        "source_id": { "type": "string", "pattern": "^[a-z0-9](?:[a-z0-9-]{0,61}[a-z0-9])?$" },
        "objective": { "type": "string", "minLength": 1, "maxLength": 1000 },
        "bounded_context_only": { "const": true },
        "citation_required": { "const": true },
        "allowed_artifact_level": { "enum": ["metadata_only", "cited_facts_only"] }
      }
    },
    "requested_compute_profile": { "enum": ["auto", "low", "medium", "high", "xhigh", "max"] },
    "compute_caps": {
      "type": "object",
      "additionalProperties": false,
      "properties": {
        "maxAgents": { "type": "number", "minimum": 1, "maximum": 30 },
        "maxDelegationDepth": { "type": "number", "minimum": 0, "maximum": 4 },
        "maxParallel": { "type": "number", "minimum": 1, "maximum": 8 },
        "maxIterations": { "type": "number", "minimum": 1, "maximum": 5 },
        "maxDurationMs": { "type": "number", "minimum": 1 },
        "maxCostUsd": { "type": "number", "minimum": 0 },
        "maxContextTokens": { "type": "number", "minimum": 1 },
        "strictBudgetRequired": { "const": true },
        "oracleRequired": { "const": true }
      }
    },
    "capture_mode_policy": {
      "type": "object",
      "additionalProperties": false,
      "required": [
        "mode",
        "semantic_mode",
        "metadata_only",
        "parent_owned_dispatch",
        "child_direct_dispatch_allowed",
        "network_access_allowed",
        "source_mutation_allowed",
        "knowledge_backend_write_allowed"
      ],
      "properties": {
        "mode": { "enum": ["plan_only", "read_only_scan", "metadata_workflow"] },
        "semantic_mode": { "enum": ["full_capture", "architecture_only", "targeted_capture", "sample_first", "context_only"] },
        "targeted_domains": {
          "type": "array",
          "items": { "enum": ["architecture", "api", "services", "database", "queues", "workers", "tests", "config", "ui", "agentic_assets", "docs"] },
          "uniqueItems": true
        },
        "large_repo_fallback": { "enum": ["architecture_only", "targeted_capture", "sample_first", "context_only"] },
        "metadata_only": { "const": true },
        "parent_owned_dispatch": { "const": true },
        "child_direct_dispatch_allowed": { "const": false },
        "network_access_allowed": { "const": false },
        "source_mutation_allowed": { "const": false },
        "knowledge_backend_write_allowed": { "const": false },
        "durable_promotion_allowed": { "const": false }
      }
    },
    "source_project": {
      "type": "object",
      "additionalProperties": false,
      "required": ["source_id", "path"],
      "properties": {
        "source_id": { "type": "string", "pattern": "^[a-z0-9](?:[a-z0-9-]{0,61}[a-z0-9])?$" },
        "path": { "type": "string", "minLength": 1 },
        "description": { "type": "string", "maxLength": 1000 }
      }
    },
    "read_policy": {
      "type": "object",
      "additionalProperties": false,
      "required": ["allowed_paths", "forbidden_patterns", "forbid_secret_like_paths", "max_file_bytes", "external_project_scan_allowed"],
      "properties": {
        "allowed_paths": { "type": "array", "items": { "type": "string", "minLength": 1 }, "minItems": 1 },
        "forbidden_patterns": { "type": "array", "items": { "type": "string", "minLength": 1 }, "minItems": 1 },
        "forbid_secret_like_paths": { "const": true },
        "max_file_bytes": { "type": "number", "minimum": 1, "maximum": 1048576 },
        "external_project_scan_allowed": { "const": false }
      }
    },
    "sample_project": {
      "type": "object",
      "additionalProperties": false,
      "required": ["name", "neutral_domain", "generation_policy", "copy_policy", "quarantine_required"],
      "properties": {
        "name": { "type": "string", "pattern": "^[A-Za-z0-9._-]+$" },
        "neutral_domain": { "type": "string", "minLength": 1 },
        "generation_policy": { "enum": ["plan_only", "quarantine_only"] },
        "copy_policy": { "enum": ["structure_and_patterns_only", "no_copy_plan_only"] },
        "quarantine_required": { "const": true }
      }
    },
    "promotion": {
      "type": "object",
      "additionalProperties": false,
      "required": ["writeback_policy", "requires_oracle_pass", "requires_human_approval", "durable_promotion_allowed"],
      "properties": {
        "writeback_policy": { "const": "proposal_only" },
        "requires_oracle_pass": { "const": true },
        "requires_human_approval": { "const": true },
        "durable_promotion_allowed": { "const": false }
      }
    }
  }
}
